"157","","8","en","219073551","6","1","","0","3","1","1","0","0","0","0","0","4","1","4","/surveys/upload/surveys/841769/files/agent1_highlights_div_lrp.mp4","/surveys/upload/surveys/841769/files/agent2_highlights_div_lrp.mp4","/surveys/upload/surveys/841769/files/agent3_highlights_div_lrp.mp4","","","","","","A3","A3","A2","A2","A1","","","","","A1","A2","A2","","","","-1","","","","","","","","","","","","","","","","","","","","","","","","","","","","","","","","","","","","","","","","","","","","","","","","","","","","","","","","","","","","","","","","","","","","","","501.93","76.59","","","","","","","","","","3.01","","","","","","","135.32","","","133.59","","","","","","3.27","","","49.87","","","61.92","","","","38.36","","","","","","","","","","","","","","","","","","","","","","","","","","","","","","","","","","","","","","","","","","","","","","","","","","","","","","","","",""
"158","1980-01-01 00:00:00","17","en","1822477299","3","1","","0","4","1","1","1","0","0","0","0","5","2","2","/surveys/upload/surveys/841769/files/agent1_highlights_div.mp4","/surveys/upload/surveys/841769/files/agent2_highlights_div.mp4","/surveys/upload/surveys/841769/files/agent3_highlights_div.mp4","","","","","","A3","A3","A2","A2","A1","","","","","","","A2","","","","1","agent went after regular pills, power pills, and then ghosts to maximize points.","0","1","1","0","1","0","7","in the video it showed the agent going after regular pills and then Power pills so it could eat the blue ghosts.","","1","strategy was staying away from ghosts.  Also eating power pills then eating ghosts.","1","0","1","0","1","0","6","seemed to use pacman to stay away from ghosts when they weren't blue.  Then at power pills to turn the ghosts blue and eat them.","","1","agent went for the power pills first to get the bigger points.","1","0","1","0","0","0","6","based on the video the agent used pacman to always go for the power pills","5","4","1","5","","","","","","1","1","1","7","B didn't go after the blue ghosts when it at the power pills thus wasting them.","","","1","1","1","4","both utilized the same strategy of eating power pills when near ghosts.  A seemed to have multiple ghosts lined up so it could eat more.","","","1","1","2","7","A wasted power pills by not being anywhere near ghosts when it consumed them.","5","5","1","5","","","","50","35ba227e","","1078.16","47.84","","","","","","","","","","2.15","","","","","","","58.3","","","59.33","","","","","","1.28","","","266.88","","","16.9","","","","1.83","","","123.61","","","","","","","88.96","","","","","","","110.75","","","","","","","32.42","","","87.45","","","","","","","","99.61","","","","","","","","70.09","","","","","","","","10","","","0.76","","",""
"159","1980-01-01 00:00:00","17","en","541176760","4","2","","0","3","1","1","0","0","0","0","0","3","8","3","/surveys/upload/surveys/841769/files/agent1_random_lrp_8.mp4","/surveys/upload/surveys/841769/files/agent2_random_lrp_8.mp4","/surveys/upload/surveys/841769/files/agent3_random_lrp_8.mp4","","","","","","A3","A3","A2","A2","A1","","","","","A1","A2","A2","","","","1","Pacman seemed focus on what was directly in front of him, eating regular pills.","1","1","0","0","0","0","5","Each clip showed him focused on what was in front of him","","1","Pacman was focused on eating the ghosts","1","0","0","1","0","0","5","The focus on the green area was on ghosts while having mega pills consumed.","","3","Pacman seemed more focused on trying to stay away from the ghosts. ","1","1","0","1","0","0","3","It was hard to see a strategy but overall it looked like Pacman was trying to avoid the ghosts ","3","3","4","","3","4","","","","1","1","1","4","Seems to make better progress and die less easy","","","1","1","1","5","A seems better at grabbing pills. B had a lot of weird gaps in the pill consumption.","","","2","1","2","4","I am choosing the more aggressive (I think) player who seems to have better functionality","3","3","4","","3","3","","50","38ea227e","","873.1","47.55","","","","","","","","","","1.02","","","","","","","139.73","","","95.67","","","","","","39.87","","","12.12","","","19.07","","","","0.6","","","89.57","","","","","","","50.28","","","","","","","87.15","","","","","","","81.97","","","51.33","","","","","","","","69.56","","","","","","","","68.68","","","","","","","","18.2","","","0.73","","",""
"160","1980-01-01 00:00:00","17","en","2087412518","4","2","","0","4","1","1","0","0","0","0","0","4","7","2","/surveys/upload/surveys/841769/files/agent1_highlights_div.mp4","/surveys/upload/surveys/841769/files/agent2_highlights_div.mp4","/surveys/upload/surveys/841769/files/agent3_highlights_div.mp4","","","","","","A3","A3","A2","A2","A1","","","","","","","A2","","","","1","The strategy of the AI it to consume the normal pills.  Then if pacman man collides with the blue ghosts pacman will eat them but it is not his sole strategy.","0","1","0","0","1","0","4","In the clip pacman doesn't prioritize getting to the power pills nor consuming the blue ghosts.  Pacman only goes after the normal pills and if pacman runs into a blue ghosts then pacman will consume them. ","","2","The strategy of the AI agent is to go directly to the power pills in order to eat the blue ghosts.  ","0","1","1","0","0","0","5","The agent goes directly towards the pills and when the ghosts turn blue pacman eats them.  This enables pacman to continue to find the power pills and eat the rest of the ghosts. ","","1","The strategy of the AI is to get the power pills. The AI doesn't go after the ghosts, only the power pills.","0","0","1","0","0","0","6","In the clip pacman goes right for the power pills and that is not.  Pacman does not interact with the ghosts or go near them not even when they turn blue. ","4","3","2","3","","","","","","2","1","1","4","In player A, pacman went after the power pills which enabled pacman to receive more points when he consumed the blue ghosts. ","","","2","1","2","4","I felt that player B went after the blue ghosts more.  This would increase the points scored.  Player B also went after the power pills causing the ghosts to turn blue more often.","","","2","1","2","5","In player B, pacman went after the blue ghosts more.  In my selection, pacman also tried to get the power pills which means pacman would get more points by consuming them. ","4","4","2","4","","","","40","31ea227f","","1065.61","43.29","","","","","","","","","","1.46","","","","","","","78.24","","","42.87","","","","","","1.64","","","9.46","","","8.29","","","","1.18","","","159.56","","","","","","","200.96","","","","","","","89.73","","","","","","","25.93","","","131.63","","","","","","","","94.81","","","","","","","","150.31","","","","","","","","24.55","","","1.7","","",""
"161","1980-01-01 00:00:00","17","en","1578423006","5","1","","0","4","0","","","","","","","3","6","1","/surveys/upload/surveys/841769/files/agent1_random_6.mp4","/surveys/upload/surveys/841769/files/agent2_random_6.mp4","/surveys/upload/surveys/841769/files/agent3_random_6.mp4","","","","","","A3","A3","A2","A2","A1","","","","","","","A2","","","","1","Agent strategy was to eat power pills and blue ghosts and/or eat normal pills while blue ghosts ran away.","0","1","1","0","1","0","6","Most of the clips showed blue ghosts and pacman eating them or normal pills.","","1","Agent was trying to eat pills and avoid ghosts.","0","1","0","0","0","0","6","The agent made no effort to eat power pills and go after blue ghosts.","","1","This agent appeared to be going after power pills as their strategy.  However the agent seemed to get stuck in corners and easily caught by ghosts.","0","0","1","0","1","0","6","Watching the pacman to see what the AI was attempting to accomplish.","4","3","4","3","","","Some of the agents are worse at Pacman than I am, and I'm terrible at the game.","","","1","1","1","7","A was eating pills and attempting to eat ghosts or pills while powered up.  B got stuck in corners and didn't accomplish much.","","","1","1","2","5","B was able to eat more pills and did not get stuck in the maze.","","","1","1","2","6","B ate more pills and did not go back and forth doing nothing as much as Agent A.","4","3","2","4","","","Not at this time.","30","192da227f","","1099.46","50.06","","","","","","","","","","0.52","","","","","","","143.64","","","50.96","","","","","","53.27","","","19.02","","","9.44","","","","0.83","","","101.05","","","","","","","106.71","","","","","","","172.6","","","","","","","54.96","","","99.05","","","","","","","","133.97","","","","","","","","76.05","","","","","","","","26.46","","","0.87","","",""
"162","1980-01-01 00:00:00","17","en","852621363","4","1","","0","2","1","0","1","0","0","0","0","5","8","4","/surveys/upload/surveys/841769/files/agent1_highlights_div_lrp.mp4","/surveys/upload/surveys/841769/files/agent2_highlights_div_lrp.mp4","/surveys/upload/surveys/841769/files/agent3_highlights_div_lrp.mp4","","","","","","A3","A3","A2","A2","A1","","","","","A1","A2","A2","","","","3","The AI is eating power pills and ghosts","1","0","1","0","1","0","7","Most of the green pixels (relevant) are around pac man and the blue ghosts. Power pills come into play because Pac Man eats two ghosts.","","2","Pac Man is collecting normal pills","1","1","0","0","0","0","7","The green is around Pac Man and the normal pills and Pac Man gets confused and glitches out a bit when there are no pills immediately around him.","","1","Pac man is going to eat power pills","1","0","1","0","0","0","6","Most of the green activity is power pills and pac man - he is eating power pills","5","5","2","","5","5","This was a lot of fun, I am a big pac man fan from my childhood, was cool to see the 2600 version of Ms Pac Man in this. I know it's irrelevant, but that was 100% Ms. Pac Man. :-)","","","1","1","1","7","Agent A is actively chasing ghosts, Agent B is getting confused in the corners after eating power pills","","","1","1","1","7","Player A is focusing on the ghosts while player B seems to be focusing on the walls, and dies at the end.","","","1","1","2","7","Player B is searching for power pills and ghosts -- will get a higher score","5","5","2","","5","5","","50","130ba227f","","742.69","84.22","","","","","","","","","","0.63","","","","","","","46.23","","","29.87","","","","","","38.65","","","15.55","","","19.82","","","","1.19","","","110.81","","","","","","","55.61","","","","","","","59.43","","","","","","","47.69","","","59.67","","","","","","","","59.49","","","","","","","","101.58","","","","","","","","10.92","","","1.33","","",""
"163","1980-01-01 00:00:00","17","en","1048448609","7","2","","0","4","1","1","1","0","0","0","0","3","8","1","/surveys/upload/surveys/841769/files/agent1_random_8.mp4","/surveys/upload/surveys/841769/files/agent2_random_8.mp4","/surveys/upload/surveys/841769/files/agent3_random_8.mp4","","","","","","A3","A3","A2","A2","A1","","","","","","","A2","","","","1","To eat the pills and avoid ghosts.","0","1","0","1","1","0","4","Pac man was avoiding the ghosts.","","1","To go after and eat the ghosts & cherries.","0","0","0","1","1","1","5","Pac man was chasing down the ghosts and cherries.","","2","To eat the small pills quickly.","0","1","0","0","0","0","5","The amount of pills eaten quickly.","5","5","1","5","","","Fun to play Pac Man","","","1","1","1","3","The players were close in performance.","","","1","1","1","7","Pacman was going after the higher points","","","1","1","2","6","Pacman was more aggressive in going after points.","5","5","1","5","","","Fun","40","46ba227f","","1208.03","88.18","","","","","","","","","","1.19","","","","","","","166.24","","","101.04","","","","","","0.94","","","20.29","","","40.68","","","","8.3","","","130.23","","","","","","","98.74","","","","","","","178.23","","","","","","","47.33","","","100.29","","","","","","","","114.67","","","","","","","","80.78","","","","","","","","29.58","","","1.32","","",""
"164","1980-01-01 00:00:00","17","en","367396291","4","1","","0","3","1","1","1","0","0","0","0","4","10","3","/surveys/upload/surveys/841769/files/agent1_random_lrp_10.mp4","/surveys/upload/surveys/841769/files/agent2_random_lrp_10.mp4","/surveys/upload/surveys/841769/files/agent3_random_lrp_10.mp4","","","","","","A3","A3","A2","A2","A1","","","","","A1","A2","A2","","","","-1","it seems to be looking right in front of itself and also looking at some of the larger corner obstacles and side exits, maybe as escape strategies.","1","0","0","1","0","0","6","because that seems to be all it's really looking at other than walls/objects and the other objects aren't on screen","","-1","to get away from the ghost near it and move to another corner, possibly lower left","0","1","0","1","0","0","4","this one doesn't seem too complex and again there seems to be some attention paid to things not on the list (walls/objects)","","-1","this image doesn't seem to have any ""hotspots"" so i have no idea.","1","0","0","0","0","0","1","there are no highlights/hotspots on this image","3","2","3","","2","4","","","","3","3","2","6","pacman a immediately gets eaten, so it's hard to judge.","","","1","1","1","5","pacman a isn't in imminent danger of being eaten.","","","1","1","1","5","player a seems to move around the board better","4","3","3","","3","2","","20","225aa227f","","861.83","36.16","","","","","","","","","","0.83","","","","","","","78.78","","","24.07","","","","","","0.66","","","41.89","","","16.68","","","","1.31","","","162.95","","","","","","","230.01","","","","","","","69.62","","","","","","","31.98","","","61.14","","","","","","","","40.78","","","","","","","","50.95","","","","","","","","12.57","","","1.45","","",""
"165","1980-01-01 00:00:00","17","en","222246938","4","2","","0","2","0","","","","","","","5","2","3","/surveys/upload/surveys/841769/files/agent1_random_lrp_2.mp4","/surveys/upload/surveys/841769/files/agent2_random_lrp_2.mp4","/surveys/upload/surveys/841769/files/agent3_random_lrp_2.mp4","","","","","","A3","A3","A2","A2","A1","","","","","A1","A2","A2","","","","1","AT FINALLY, THE PACMAN TAKE THE POWER PILL AND THE GHOSTS ARE TURNED INTO BLUE. HENCE,IN LAST AI AGENT MAY BE ATE AL THE PILLS BEFORE THE GHOSTS CATCH IT","1","0","1","0","1","0","5","PACMAN NEED TO TAKE MORE NUMBER OF PILLS AT LAST.SO,THE PACMAN NEED POWER PILLS TO COMPLETE THE TASK","","3","IN THIS, THE AI AGENT SHOWS THAT A PACMAN EATS ALL THE PILLS AND ALSO THE POWER PILLS ARE THERE IN THIS STRATEGY.AT ONE SCENARIO,THE BLUE GHOSTS ARE PRESENT AND THE PACMAN EATS THE PILL QUICKLY","1","0","1","0","1","0","6","IN THIS SCENARIO, MORE NUMBER OF PILLS ARE PRESENT. SO, PACMAN NEEDS TO TAKE ALL THE PILLS AND THE GHOSTS WERE ALSO NEARER TO THE PACMAN ","","2","THIS AI AGENT CAN COMPLETE THIS TASK SUCCESSFULLY ","1","0","1","0","0","1","6","BEFORE THE LAST STRATEGY, CHERRY WAS THERE IN THAT SCENARIO.UT PACMAN CAN NOT CATCH THAT. SO, IT NEEDS ANOTHER CHERRY TO INCREASING THE POINTS","3","4","4","","4","3","","","","1","1","1","5","PACMAN PLAYER A ALREADY TAKE ANY NUMBER OF PILLS. HENCE THE NUMBER OF PILLS NEED TO BE ATE ONLY LOW QUANTITY OF PILLS ","","","1","1","2","5","PACMAN PLAYER B HAD MANY NUMBER OF CHANCES TO ATE ALL THE PILLS","","","1","3","2","6","PLAYER B TAKES MORE NUMBER OF PILLS. SO,NUMBER OF PILLS NEED ED TO TAKE WAS LOW","3","4","4","","3","4","","30","218aa2280","","2063.3","193.73","","","","","","","","","","4.1","","","","","","","130.5","","","64.92","","","","","","2.88","","","48.81","","","63.83","","","","19.69","","","299.98","","","","","","","451.15","","","","","","","268.65","","","","","","","24.65","","","215.43","","","","","","","","135.56","","","","","","","","126.13","","","","","","","","11.23","","","2.06","","",""
"166","1980-01-01 00:00:00","17","en","683399566","5","1","","0","4","1","1","0","0","0","0","0","4","6","3","/surveys/upload/surveys/841769/files/agent1_random_lrp_6.mp4","/surveys/upload/surveys/841769/files/agent2_random_lrp_6.mp4","/surveys/upload/surveys/841769/files/agent3_random_lrp_6.mp4","","","","","","A3","A3","A2","A2","A1","","","","","A1","A2","A2","","","","1","IT appears the AI actively went after blue ghosts after eating a power pill, but then the AI appeared to be more concerned with the walls.","1","0","1","0","1","0","2","I watched the video. this constant requirement to justify my selections is increasingly irritating and just makes me want to quit. The AI sucks at this game and so far none of these scenarios make any sense at all.
","","1","At first it appeared as if the AI was simply trying to clear dots. but at the end it just sporadically moved right/left for no reason whatsoever.","1","1","0","0","1","0","2","Again, this AI doesn't appear to have an actual strategy. It ate a blue ghost once, and then just moved right/left for no reason.","","1","IT doesn't appear to be using any strategy. at the beginning it simply sat in one place until killed. in the follow-ups it didn't appear to do anything but move randomly.
","1","1","0","0","0","0","2","since the AI appeared to not be using any strategy whatsoever, I simply chose the 2 most important things. MS pacman and the regular dots","1","1","5","","2","2","YES. This isn't PACMAN, it's MS. PACMAN and it's the crappy console version. ","","","1","2","1","7","Agent B just sits in one spot and lets a ghost kill them.","","","1","1","2","7","Agent A did the sporadic right/left nonsense for no reason at all. it also appeared to just stop for no reason and make random course changes.","","","1","2","2","7","the player A video is the exact same as the player B video from the previous question. ","2","3","5","","4","2","MS. PACMAN","30","226da2281","","2743.95","49.26","","","","","","","","","","1.15","","","","","","","478.19","","","24.51","","","","","","1.52","","","203.02","","","23.68","","","","1.49","","","159.91","","","","","","","143.2","","","","","","","153.91","","","","","","","65.89","","","558.23","","","","","","","","112.87","","","","","","","","473.48","","","","","","","","292.41","","","1.23","","",""
"167","1980-01-01 00:00:00","17","en","1767874510","3","1","","0","4","1","1","0","0","0","0","0","4","7","2","/surveys/upload/surveys/841769/files/agent1_highlights_div.mp4","/surveys/upload/surveys/841769/files/agent2_highlights_div.mp4","/surveys/upload/surveys/841769/files/agent3_highlights_div.mp4","","","","","","A3","A3","A2","A2","A1","","","","","","","A2","","","","1","The AI seemed to focus on eat ghosts but also clearing the stage.","0","1","1","0","1","0","7","The AI clear much of the stage and also ate ghosts. It died once so it wasnt too concerned about that.","","1","The AI wanted to eat as many ghosts as it could.","1","0","1","0","1","0","5","The pacman ate a lot of ghosts during the video.","","2","The strategy of the AI agent was to eat the power pill and then immediately turn around. It did not appear to move anywhere else after than.","1","1","1","0","0","0","6","Those were the only three objects the AI agent interacted with.","3","3","2","4","","","none","","","1","1","1","7","This agent cleared much more of the stage and went after the ghosts better after eating the power pills.","","","1","1","1","6","I didnt see this agent die and the agent ate alot of ghost. They also cleared the about the same amount of the stage.","","","1","1","2","7","This AI was more aggressive at eating ghosts. It know what to do after eating the power pills.","5","4","4","3","","","none","50","49aa2281","","1923","48.36","","","","","","","","","","0.89","","","","","","","38.09","","","39.91","","","","","","17.46","","","7.54","","","13.81","","","","1.32","","","1003.24","","","","","","","89.24","","","","","","","157.84","","","","","","","25.21","","","77.65","","","","","","","","269.74","","","","","","","","118.66","","","","","","","","13.26","","","0.78","","",""
"168","1980-01-01 00:00:00","17","en","1715131218","4","2","","0","4","0","","","","","","","3","9","4","/surveys/upload/surveys/841769/files/agent1_highlights_div_lrp.mp4","/surveys/upload/surveys/841769/files/agent2_highlights_div_lrp.mp4","/surveys/upload/surveys/841769/files/agent3_highlights_div_lrp.mp4","","","","","","A3","A3","A2","A2","A1","","","","","A1","A2","A2","","","","2","Looking at the heatmap, this agent is trying to conquer the whole board and is really focused on hunting down ghosts.  Its strategy seems to be to collect power pills and then hunt ghosts so it can gather up regular pills from the center of the board while the ghosts are regenerating. ","0","1","1","0","1","0","3","I am less confident on this one because the heatmap could indicate another explanation. I probably would have to see more clips to be sure.","","2","It focuses on the space in front of it and the over-arching strategy seems to be to collect regular pills and power pills from the corners first and then later collect from the center around the ghost regeneration square. It seems to minimize contact with ghosts unless it has eaten a power pill.","1","0","1","0","1","0","4","I watched the video and in my mind it is a half way decent explanation of the behavior. ","","1","This agent seems to be focusing on the outsides of the board and the corners. It eats the power pills but does not seem to go after the vulnerable ghosts. It is focusing less on the regular pills and seems to be zeroing on power pills. ","1","0","1","0","0","0","4","The video clips seem to support my explanation. The regular pills seem to only be collected because they are in the pacman's path as the agent zeroes in on the power pills.","4","3","3","","4","4","Fun study.","","","1","1","1","5","Player B, according to the heat map, is primarily focused on the space right in front of it. It has tunnel vision. A is playing more of the board, which seems to mean that it will collect more points and brutalize ghosts.","","","1","1","1","3","It is hard to tell just from the videos. It appears player A has collected more power pills, which have a higher point value. I think there has also been more ghost gormandizing on the part of agent A too. ","","","1","1","2","3","Again, it is hard to draw too many conclusions just from the clips, but it appears B has more of a whole board strategy and isn't afraid to torture the ghosts. A seems to be more conservative. ","4","3","3","","4","4","","40","147ca2281","","1811.61","62.28","","","","","","","","","","0.98","","","","","","","145.87","","","97.81","","","","","","44.35","","","43.7","","","28.04","","","","0.8","","","203.7","","","","","","","345.18","","","","","","","234.5","","","","","","","103.28","","","121.7","","","","","","","","168.8","","","","","","","","178.41","","","","","","","","30.75","","","1.46","","",""
"169","1980-01-01 00:00:00","17","en","1178614946","4","1","","0","4","0","","","","","","","3","6","4","/surveys/upload/surveys/841769/files/agent1_highlights_div_lrp.mp4","/surveys/upload/surveys/841769/files/agent2_highlights_div_lrp.mp4","/surveys/upload/surveys/841769/files/agent3_highlights_div_lrp.mp4","","","","","","A3","A3","A2","A2","A1","","","","","A1","A2","A2","","","","1","It seemed that the AI's strategy was to focus on getting power pills to turn the ghosts and get additional points by eating the ghosts. The pacman ate the normal pills on route to these pursuits.","0","0","1","0","1","0","5","I saw the pacman attempt to move towards ghosts as much as possible. It seem like the AI player was attempting to set up a situation where the pacman could eat a power pill and quickly eat a ghost for maximum points.","","1","The strategy appear to avoid ghosts as much as possible until it becomes clear of the direction of the ghosts and if a power pill is nearby. The AI then makes a decision to quickly move towards a power pill to be able to consumer it and a ghost quickly.","1","0","1","0","1","0","3","There were several instances where the pacman seemed to idle while waiting for an opportunity. Upon finding a power pill the pacman quickly moved to consume ghosts.","","1","I believe the strategy was to avoid ghosts while changing direction if a power up pill appeared to get more points. ","0","0","1","0","0","0","5","After reviewing the video it seemed that the pacman changed direction to get the power pill frequently","3","3","4","","4","4","","","","1","1","1","5","I see player A attempting to stay near ghosts or quickly move towards them in the event of a power pill.","","","1","1","2","4","Player A seemed to spend more time idling while searching for opportunities than B that seemed to go right after power pills and ghosts","","","1","1","1","3","These two players seemed somewhat equally matched buy play A seemed to have taken better advantage of opportunities.","3","3","4","","3","4","","10","254aa2280","","1101.14","58.6","","","","","","","","","","1.2","","","","","","","246.7","","","52.53","","","","","","1.08","","","13.27","","","20.89","","","","1.41","","","134.46","","","","","","","129.07","","","","","","","102.77","","","","","","","24.68","","","155.65","","","","","","","","83.68","","","","","","","","60.61","","","","","","","","13.45","","","1.09","","",""
