"186","1980-01-01 00:00:00","17","en","586314234","4","1","","0","4","1","0","0","1","0","1","0","5","7","1","/surveys/upload/surveys/841769/files/agent1_random_7.mp4","/surveys/upload/surveys/841769/files/agent2_random_7.mp4","/surveys/upload/surveys/841769/files/agent3_random_7.mp4","","","","","","A3","A3","A2","A2","A1","","","","","","","A2","","","","5","eating ghosts and chasing power pills. also gobbling up the normal pills vertically.","1","1","1","1","0","0","5","he was chasing down the power pills and eatable ghosts. gobbling up normal pills as well.","","1","seems as if he is just eating normal pills here.","1","1","0","0","0","0","6","same. he seems to just be going after normal pills here.","","3","I didn't see much strategy. He sat not moving and was eaten, then ran from the ghosts and then went thru the left portal ...I suppose this was the strategy?","1","0","0","1","0","0","5","The AI seemed to run from the ghosts. I did not see a lot of strategy.","2","3","2","4","","","would need to study the player behaviour longer to really determine intent.  good study.","","","1","1","1","7","much more mobile in the game. chasing down power pills and eatable ghosts.","","","1","1","2","6","same as before. more mobile and active in chasing down eatable ghosts and power pills.","","","1","1","2","2","they both have big weaknesses...just frozen a bit.  these are similar players in my opinion.","3","3","4","4","","","this is fun.","20","75ea2283","","1298.07","49.08","","","","","","","","","","1.16","","","","","","","139.05","","","68.59","","","","","","30.97","","","11.51","","","15.74","","","","1.83","","","232.18","","","","","","","118.37","","","","","","","261.79","","","","","","","80.69","","","96.22","","","","","","","","71.47","","","","","","","","83.03","","","","","","","","35.1","","","1.29","","",""
"187","1980-01-01 00:00:00","17","en","732458090","4","2","","0","2","1","1","1","1","0","0","0","4","4","3","/surveys/upload/surveys/841769/files/agent1_random_lrp_4.mp4","/surveys/upload/surveys/841769/files/agent2_random_lrp_4.mp4","/surveys/upload/surveys/841769/files/agent3_random_lrp_4.mp4","","","","","","A3","A3","A2","A2","A1","","","","","A1","A2","A2","","","","2","While the goal in a few of the videos was to get the normal pills, the heat map stayed on Pacman the whole time and didn't really encourage it to go towards anything special.","1","1","0","0","0","0","7","I rewatched the video a couple of times and there were more instances of the AI going towards an empty area or the wall than there were of him going towards pills.","","2","Most of these were totally different, the AI mostly just moved and didn't have a focus.","1","0","0","0","0","0","6","There wasn't any real focus, it was just to move","","2","This AI moved towards more power pills and regular pills, he would occasionally grab a blue ghost but not effectively","0","1","1","0","1","0","7","There was better focus in this game, he moved towards the good and away from the bad and only got sidetracked twice.","4","4","5","","5","2","The green in the videos wasn't that helpful, it was sometimes scattered across the board and other times it was only on pacman, didn't encourage him to move in one way or another.","","","2","1","2","7","There was purpose to what Pacman was moving towards, he didn't get sidetracked as often and went towards better points when applicable","","","1","1","1","4","They both had some really bad moves!","","","1","1","1","7","This AI was effective and would rack up decent points","4","4","5","","5","2","nothing extra to add","20","73da2284","","1554.03","68.61","","","","","","","","","","1.06","","","","","","","284.06","","","63.19","","","","","","0.58","","","45.9","","","23.4","","","","0.77","","","232.86","","","","","","","346.55","","","","","","","133.85","","","","","","","62.35","","","118.1","","","","","","","","69.67","","","","","","","","52.72","","","","","","","","49.98","","","0.38","","",""
"188","1980-01-01 00:00:00","17","en","1984219625","4","2","","0","3","1","1","1","0","0","0","0","5","4","4","/surveys/upload/surveys/841769/files/agent1_highlights_div_lrp.mp4","/surveys/upload/surveys/841769/files/agent2_highlights_div_lrp.mp4","/surveys/upload/surveys/841769/files/agent3_highlights_div_lrp.mp4","","","","","","A3","A3","A2","A2","A1","","","","","A1","A2","A2","","","","1","I think this AI agent was focused on making the ghosts blue so they could be eaten.","0","0","1","0","1","0","7","The areas around power pills and ghosts were highlighted.","","2","This AI agent seemed to be focused on just Pacman and clearing everything in an area.","1","0","0","0","0","0","5","Pacman was the only thing that seemed to be of interest to this AI agent.","","1","This AI agent focused on the power pills.","0","0","1","0","0","0","7","Only the power pills or the area around them were lit with green, so I'm confident this was the most relevant thing for the AI. ","4","5","2","","5","5","N/A","","","1","1","1","7","Agent A is focused on obtaining the most points.","","","1","1","2","7","Player B is focused on clearing the entire board I think.","","","2","1","1","4","Player A seems to be more interested in power pills, thus player A should get more points.","4","4","1","","5","5","N/A","10","123ca2287","","1805.61","172.35","","","","","","","","","","1.87","","","","","","","320.92","","","40.4","","","","","","1.76","","","89.65","","","46.79","","","","2.02","","","163.9","","","","","","","268.11","","","","","","","218.12","","","","","","","34.82","","","138.26","","","","","","","","128.66","","","","","","","","138.92","","","","","","","","36.92","","","2.14","","",""
"240","1980-01-01 00:00:00","17","en","250742246","3","2","","0","1","1","1","0","0","0","0","0","1","4","1","/surveys/upload/surveys/248468/files/agent1_random_4.mp4","/surveys/upload/surveys/841769/files/agent2_random_4.mp4","/surveys/upload/surveys/841769/files/agent3_random_4.mp4","","","","","","A3","A3","A2","A2","A1","","","","","","","A2","","","","1","trying to avoid being got by the ghosts ","1","1","0","0","0","0","4","I guessed based off what I observed. The AI seemed focused on just getting the normal pills and avoiding the ghosts","","1","I can't figure out the strategy here","1","0","0","0","0","0","1","I'm not sure I didn't see any particular strategy ","","1","I really don't know I don't see any kind of strategy. It seems like its just trying to stay away from the ghosts but not really doing much else. ","1","0","0","0","0","0","1","I just went on what I observed.","1","1","5","1","","","","","","1","1","2","5","A got eaten whereas B did not","","","1","1","2","4","B seemed to be more focused on the goal where A seemed to have more trouble.","","","1","1","2","1","I think both seemed bad so I went with what I observed to be the better of the two","1","1","5","1","","","","20","248ea22d8","","854.06","25.08","","","","","","","","","","0.69","","","","","","","136.36","","","38.18","","","","","","207.26","","","4.75","","","6.99","","","","0.39","","","93.53","","","","","","","56.25","","","","","","","78.72","","","","","","","12.71","","","55.63","","","","","","","","54.81","","","","","","","","71.86","","","","","","","","10.13","","","0.72","","",""
"241","1980-01-01 00:00:00","17","en","94744373","3","2","","0","3","1","1","0","1","0","0","0","4","4","1","/surveys/upload/surveys/248468/files/agent1_random_4.mp4","/surveys/upload/surveys/841769/files/agent2_random_4.mp4","/surveys/upload/surveys/841769/files/agent3_random_4.mp4","","","","","","A3","A3","A2","A2","A1","","","","","","","A2","","","","2","This AI agent seems to know to eat power pellets and go after ghosts.","1","0","1","1","0","0","5","There were instances where power pellets are missing in certain clips of the video and ghosts are replaced with flickering eyes/blue ghosts, and it happens among all four clips.","","3","Initially, the AI agent tried to eat ghosts,  but on the second clip, it got close to one and then reversed back. However, in the next two clips, it went back to trying to eat ghosts again, yet in the final clip, it had acquired the power pellet and it was safe to eat them this time.","1","0","0","1","0","0","5","The repeated actions of trying to eat ghosts seems most logical.","","2","This AI agent also prioritizes eating just power pills, not so much the ghosts afterwards.","1","0","1","0","0","0","6","He doesn't seem to target ghosts, and the normal pills and cherries are left on the field as often as possible","4","4","2","4","","","This was surprisingly fun and now I want to go replay Pacman!","","","2","1","1","7","This one seeks out ghost to eat after getting power pills and doesn't just stop moving","","","3","2","2","6","This one is able to get power pills and also seeks out ghosts to eat, as well.","","","1","2","2","7","He actually  makes an attempt to get regular pills, not just power pills","5","5","1","5","","","","50","41ba22d8","","877.39","71.1","","","","","","","","","","1.06","","","","","","","44.01","","","27.26","","","","","","8.1","","","28.06","","","5.49","","","","1.7","","","190.99","","","","","","","162.61","","","","","","","125.56","","","","","","","30.41","","","48.56","","","","","","","","42.32","","","","","","","","77.07","","","","","","","","12.11","","","0.98","","",""
"242","1980-01-01 00:00:00","17","en","2055234162","4","2","","0","2","1","1","1","0","0","0","0","4","5","2","/surveys/upload/surveys/248468/files/agent1_highlights_div.mp4","/surveys/upload/surveys/841769/files/agent2_highlights_div.mp4","/surveys/upload/surveys/841769/files/agent3_highlights_div.mp4","","","","","","A3","A3","A2","A2","A1","","","","","","","A2","","","","2","The strategy appears to be for Pacman to eat power pills as quickly as possible.","0","0","1","0","1","0","6","Based on the video clips, the agent chose to go after the power pills right away and then chase down and eat the ghosts.","","2","The strategy here seems more chaotic. I believe the strategy is simply to not get eaten by the ghosts.","1","0","0","0","1","0","3","Based on the movements, the AI was simply trying to avoid the ghosts unless they were blue. It didn't appear to be going after anything in particular.","","2","Again, the AI seems to be going after the power pills first; but this time turns around right afterward, away from normal pills.","0","0","1","0","0","0","7","Pacman is seen only chasing down power pills and then going back away from normal pills.","4","3","4","4","","","No additional comments.","","","2","2","1","7","Player A seems to be going after the power pills, trying to get the higher point items first.","","","2","2","2","6","Player B seems more ""confident"" in their movements and had more of the board cleared. Also, it seemed to be more aggressive in its approach. ","","","2","2","1","5","Player A seems to be more certain because in its movements like it has learned the game more than Player B.","4","4","3","4","","","None","30","148ba22d9","","1750.92","92.54","","","","","","","","","","1.43","","","","","","","121.9","","","38.33","","","","","","1.2","","","24.18","","","16.09","","","","0.93","","","185.78","","","","","","","286.91","","","","","","","243.06","","","","","","","55.28","","","251.94","","","","","","","","188.28","","","","","","","","209.14","","","","","","","","32.48","","","1.45","","",""
"243","1980-01-01 00:00:00","17","en","217310984","3","2","","0","4","0","","","","","","","4","8","1","/surveys/upload/surveys/248468/files/agent1_random_8.mp4","/surveys/upload/surveys/841769/files/agent2_random_8.mp4","/surveys/upload/surveys/841769/files/agent3_random_8.mp4","","","","","","A3","A3","A2","A2","A1","","","","","","","A2","","","","3","AI is going around eating the normal pills avoiding the ghost any chance he/she gets","1","1","0","1","0","0","7","Well pac-man is eating the normal pills every chance he gets, and every time he sees a ghost he turns around and goes into the opposite direction ","","6","The AI agent keep going in different areas but seem to be going after the ghost even if they were not light up, also i noticed the AI was having trouble getting the hang of this game since it keep going in areas that have already been cleared.","1","0","1","1","0","0","6","well pac-man is the most important one sicne its your guy that you use, then i seen it eat power pills several times and well the ghosts are really important to this game also","","1","Ai agent seem to be a little confused or getting stuck since i seen it get stuck going back an forth in the same area a couple of times. But he was eating the pills ","1","1","1","1","0","0","7","Pac-man was eating the normal pills and also got some power pills but a ghost did eat him since he got stuck in a corner it seemed like","5","4","1","5","","","I find it very intrestsing that an AI agent can play better then some people","","","1","1","1","7","Well A AI agent seems to be more open, knows the game really well when to turn, when to collect the ghost when to run away from the ghost. While B AI agent tends to get confused, also it stops so in a corner like it does no know how to turn really well so it gets eaten more","","","1","1","2","7","Well first off it was a hard choice since they both can play better then me but b seems to know the game more quite well and knows when to turn away from the ghost. Their both equally good in my opinion ","","","1","1","2","6","I prefer B AI since it does not get stuck in corners from what i see and also its not as confused as A AI","5","4","3","5","","","none","40","190ba22d9","","1455.09","57.16","","","","","","","","","","0.81","","","","","","","189.58","","","126.49","","","","","","19.24","","","31.89","","","23.27","","","","0.82","","","130.41","","","","","","","282.47","","","","","","","157.39","","","","","","","52.98","","","134.18","","","","","","","","133.29","","","","","","","","94.08","","","","","","","","20.23","","","0.8","","",""
"244","1980-01-01 00:00:00","17","en","1904049906","4","1","","0","4","1","1","1","0","0","0","0","4","10","2","/surveys/upload/surveys/248468/files/agent1_highlights_div.mp4","/surveys/upload/surveys/841769/files/agent2_highlights_div.mp4","/surveys/upload/surveys/841769/files/agent3_highlights_div.mp4","","","","","","A3","A3","A2","A2","A1","","","","","","","A2","","","","1","Get power pills so it can eat ghosts","1","0","1","0","1","0","6","It seeks power pills and then blue ghosts","","2","Hunt blue ghosts","1","0","0","0","1","0","6","It approached blue ghosts to eat them","","1","Turn around after getting a power pill","1","0","1","0","1","0","6","Those are the three objects involved in power pills","4","3","4","4","","","n","","","2","1","1","5","B just turns around after getting a power pill, A focuses on clearing pills more","","","1","2","2","5","Less pointless wobbling and stray pills left behind","","","2","1","1","5","A seems to do a better job of clearing the board of pills","4","3","3","4","","","n","20","227ba22d8","","535.04","41.26","","","","","","","","","","0.93","","","","","","","24.71","","","27.36","","","","","","48.95","","","7.2","","","13.64","","","","1.29","","","64.52","","","","","","","78.12","","","","","","","56.08","","","","","","","17.26","","","43.16","","","","","","","","56.82","","","","","","","","40.23","","","","","","","","12.4","","","1.11","","",""
"245","1980-01-01 00:00:00","17","en","1691964260","6","1","","0","1","1","0","0","1","0","0","0","5","1","2","/surveys/upload/surveys/248468/files/agent1_highlights_div.mp4","/surveys/upload/surveys/841769/files/agent2_highlights_div.mp4","/surveys/upload/surveys/841769/files/agent3_highlights_div.mp4","","","","","","A3","A3","A2","A2","A1","","","","","","","A2","","","","1","It's pretty good one to use and play ","1","0","1","0","0","1","6","Based on the game i made it ","","-1","It's always based on how we select the pills and ways","0","0","1","0","1","1","5","Based on the video","","1","The AI plays pretty well","0","0","1","0","1","1","6","pretty good ","4","4","4","5","","","","","","-1","-1","1","6","Based on the instructions i have done this","","","-1","-1","2","6","Player B would play better ","","","-1","-1","2","5","I think player B would play better","5","4","4","4","","","","20","244ba22d9","","1570.68","82.27","","","","","","","","","","1.55","","","","","","","43.83","","","82.59","","","","","","827.23","","","6.2","","","38.17","","","","11.12","","","69.13","","","","","","","156.56","","","","","","","57.15","","","","","","","18.76","","","109.53","","","","","","","","30.57","","","","","","","","24.85","","","","","","","","10.05","","","1.12","","",""
"246","1980-01-01 00:00:00","17","en","1996232861","4","1","","0","4","0","","","","","","","4","1","1","/surveys/upload/surveys/248468/files/agent1_random_1.mp4","/surveys/upload/surveys/841769/files/agent2_random_1.mp4","/surveys/upload/surveys/841769/files/agent3_random_1.mp4","","","","","","A3","A3","A2","A2","A1","","","","","","","A2","","","","1","This AI agent was motivated to get the power pill as fast as possible. ","0","0","1","0","0","0","7","Most short clips was showing pacman going for the power pill.","","1","AI agent plays very safe, keeping his distance and not taking any chances. Not a risk taker.","1","0","0","0","0","0","6","Like I said, agent was afraid to loose a life and was not taking any risk.","","1","Again, power pill and eating blue ghosts is a priority for this AI agent.","0","0","1","0","1","0","7","Agent was eating blue ghost and allowing blue ghost to touch him after he got a power pill.","4","3","4","4","","","ty","","","1","1","1","6","There was one clip on player B I didn't like - wasting time waiting for a ghost to touch him.","","","2","1","2","6","Agent A seemed like he didn't know what he was doing... like he didn't know the rules...","","","1","1","1","6","I guess A was more skillful... even tho it's the one wasting time waiting for the ghost to touch him...","4","3","3","4","","","ty","20","71ca22d9","","868.61","63.15","","","","","","","","","","0.59","","","","","","","88.14","","","41.63","","","","","","1.02","","","11.96","","","15.45","","","","0.83","","","69.23","","","","","","","133.7","","","","","","","132.79","","","","","","","25.36","","","92.08","","","","","","","","99.88","","","","","","","","72.65","","","","","","","","18.85","","","1.3","","",""
"247","1980-01-01 00:00:00","17","en","895906296","5","1","","0","4","1","1","0","0","0","0","0","6","4","1","/surveys/upload/surveys/248468/files/agent1_random_4.mp4","/surveys/upload/surveys/841769/files/agent2_random_4.mp4","/surveys/upload/surveys/841769/files/agent3_random_4.mp4","","","","","","A3","A3","A2","A2","A1","","","","","","","A2","","","","2","Appeared to be a defensive strategy, keeping distance from ghosts. Though it also spent time near the fruit payout area, so that might have been the agent's motivation.","1","0","0","0","0","1","5","The extra time spent where there were no pills, away from ghosts, suggests a defensive strategy. Some of that time was near the fruit payoff area, so that might be motivation for dwelling where there are no pills to collect.","","1","Mostly dying and spawning, suggests no real strategy and poor game-play.","0","1","0","1","0","0","6","There were no apparent winning strategies conveyed, so this agent may have been ill informed or playing with different goals.","","1","This agent seemed to waste time covering ground with no points or target. Inefficient time spent in corner with no planned action.","0","0","1","1","0","0","6","The frantic, though unsuccessful chase of blue ghosts, and the rapid reversal upon eating a power pill  suggests those as priorities.","4","2","3","3","","","","","","1","1","1","3","Player B missed some opportunities and wasted time undecided in a corner. While player A at least showed some ghost-eating motivation.","","","2","1","2","7","Agent B's clip showed many more ghost eyes (eaten ghosts) indicating a more aggressive game strategy.","","","1","2","1","6","Player A appeared to ""save"" a power pill, and wait for blue ghosts to gather, where player B must have eaten a power pill at a less opportune time --blue ghosts were still in the central pen.","4","2","2","3","","","","20","107da22da","","1657.62","135.93","","","","","","","","","","1.96","","","","","","","124.4","","","34.43","","","","","","1.37","","","16.88","","","10.82","","","","1.71","","","321.72","","","","","","","173.56","","","","","","","246.34","","","","","","","37.56","","","142.09","","","","","","","","167.89","","","","","","","","211.13","","","","","","","","27.95","","","1.88","","",""
"248","","3","en","718897315","3","1","","0","4","0","","","","","","","3","10","2","/surveys/upload/surveys/248468/files/agent1_highlights_div.mp4","/surveys/upload/surveys/841769/files/agent2_highlights_div.mp4","/surveys/upload/surveys/841769/files/agent3_highlights_div.mp4","","","","","","","","","","","","","","","","","","","","","","","","","","","","","","","","","","","","","","","","","","","","","","","","","","","","","","","","","","","","","","","","","","","","","","","","","","","","","","","","","","","","","","","","","","","287.87","204.88","","","","","","","","","","2.25","","","","","","","80.74","","","","","","","","","","","","","","","","","","","","","","","","","","","","","","","","","","","","","","","","","","","","","","","","","","","","","","","","","","","","","","","","","","","","","","","","","","","",""
"249","1980-01-01 00:00:00","17","en","1214452674","3","1","","0","4","1","0","0","0","0","1","0","5","7","2","/surveys/upload/surveys/248468/files/agent1_highlights_div.mp4","/surveys/upload/surveys/841769/files/agent2_highlights_div.mp4","/surveys/upload/surveys/841769/files/agent3_highlights_div.mp4","","","","","","A3","A3","A2","A2","A1","","","","","","","A2","","","","1","None","1","0","1","0","0","1","6","I was confident to play the game.","","1","This is very interesting game and the strategy is to escape the ghost.","1","0","1","0","0","1","7","I think i would like to play this game.","","1","none","1","0","1","0","0","1","6","I have very confident to play the game.","4","5","4","4","","","None","","","1","1","2","7","I have to confident to play with B","","","1","1","2","6","I have to play very confident with player B","","","1","1","2","7","I have to confident to play with B","5","4","4","4","","","none","10","61ea22d9","","725.11","54.52","","","","","","","","","","1.93","","","","","","","16.75","","","217.38","","","","","","36.84","","","5","","","52.15","","","","1.46","","","37.95","","","","","","","105.03","","","","","","","38.08","","","","","","","13.35","","","41.46","","","","","","","","62.32","","","","","","","","26.75","","","","","","","","11.95","","","2.19","","",""
"250","1980-01-01 00:00:00","17","en","1623276610","4","1","","0","4","1","1","1","1","0","0","0","4","9","1","/surveys/upload/surveys/248468/files/agent1_random_9.mp4","/surveys/upload/surveys/841769/files/agent2_random_9.mp4","/surveys/upload/surveys/841769/files/agent3_random_9.mp4","","","","","","A3","A3","A2","A2","A1","","","","","","","A2","","","","1","It looks like their strategy was just to eat pills and avoid ghosts.","1","1","0","0","0","0","2","I didn't have much to go by, but it looked like pacman was just eating pills like normal. He wasn't near any ghosts or power pills.","","2","Looks like there strategy was to eat the pills while keeping the ghosts at as much distance as possible.","1","1","0","0","0","0","2","There were a few times it looked like pacman went in reverse as a ghost was near.","","1","Doesn't look like much of a strategy. Looks like the player was stuck at a few points in the game.","1","0","0","0","0","0","1","I'm not at all confident. The player was in the same spot at different points in the video, so I couldn't really figure out their strategy.","1","1","5","1","","","","","","1","1","1","3","Player B spent lots of time not moving. That's valuable pill eating time wasted.","","","3","2","1","2","A seemed a little more defense of a player and tried avoiding ghosts.","","","2","2","2","2","A died immediately the video started. It didn't look like they were trapped either, It looked like bad decision making on their part.","1","1","5","1","","","","40","37ea22d9","","848.84","40.9","","","","","","","","","","2.02","","","","","","","110.39","","","62.14","","","","","","0.92","","","12.53","","","8.93","","","","1.72","","","82.26","","","","","","","148.75","","","","","","","112.51","","","","","","","16.25","","","54.62","","","","","","","","95.02","","","","","","","","84.25","","","","","","","","13.82","","","1.81","","",""
