"126","1980-01-01 00:00:00","17","en","434507198","4","2","","0","2","1","1","1","1","0","1","0","4","7","1","/surveys/upload/surveys/841769/files/agent1_random_7.mp4","/surveys/upload/surveys/841769/files/agent2_random_7.mp4","/surveys/upload/surveys/841769/files/agent3_random_7.mp4","","","","","","A3","A3","A2","A2","A1","","","","","","","A2","","","","1","The strategy of the AI seems to be to avoid the ghosts at all costs.","1","1","1","0","0","0","6","The power pills were never used to engage ghosts and it seemed like the AI just avoided them.","","1","The AI seemed to halfway decide where it wanted to go on its own and then halfway wait and play off of the actions of the ghosts.","1","0","0","1","1","0","4","It's not like it preferred anything in particular but a lot of the times we see it sitting still which makes me feel like the ghost movement controlled how it moved.","","2","The AI likes to play the edge and the corners of the map.","1","0","1","0","1","0","7","In most of the scenes, the ghosts were blue meaning that it favored using power pills.","4","4","1","5","","","","","","1","1","1","7","Player B sits still in the corner too much and doesn't take advantage of scoring.  A actually plays the game.","","","1","1","2","6","B seems more aggressive and more likely to get things done while A doesn't move nearly as much.","","","1","1","1","7","B died, spends time sitting still, and likes to travel already traveled territory a lot. ","4","5","2","5","","","","30","210ba227d","","1807.7","34.11","","","","","","","","","","0.75","","","","","","","202.36","","","24.48","","","","","","1.06","","","8.22","","","7.28","","","","0.79","","","622.59","","","","","","","127.49","","","","","","","131.08","","","","","","","23.09","","","240.9","","","","","","","","102.58","","","","","","","","69.53","","","","","","","","209.86","","","1.53","","",""
"127","1980-01-01 00:00:00","17","en","1837403809","4","1","","0","4","1","1","1","1","0","0","0","4","8","2","/surveys/upload/surveys/841769/files/agent1_highlights_div.mp4","/surveys/upload/surveys/841769/files/agent2_highlights_div.mp4","/surveys/upload/surveys/841769/files/agent3_highlights_div.mp4","","","","","","A3","A3","A2","A2","A1","","","","","","","A2","","","","1","hard to tell. It seems more focused on ghost eating. ","0","0","0","0","1","0","4","It just appears that the agent only wants the ghost up to the point of it's own death. ","","1","It seem mostly focused on getting pills and then eating ghost as they came near. ","0","1","0","0","1","0","6","Each scene showed the agent trying for pills but only ghost that were near.","","2","Seems the stratgey is to get the power pill.","0","1","1","0","0","0","6","The video showed many different clips of the agent just going for pills then a single power pill.","4","3","1","4","","","Have a nice day!","","","1","1","2","6","Player B does not die. Player A does die at the end. ","","","1","1","1","6","Player A did not die. Player B dies at the very end. ","","","1","1","1","6","Player A seems more focused where Player b starts looking lost at the bottom with nothing to get. Player A seems driven to catch pills and ghost. ","4","3","1","4","","","","30","62ca227c","","502.79","49.88","","","","","","","","","","1.36","","","","","","","53.58","","","24.5","","","","","","0.93","","","3.86","","","9.48","","","","0.89","","","53.62","","","","","","","65.07","","","","","","","88.44","","","","","","","25.64","","","27.77","","","","","","","","46.84","","","","","","","","38.78","","","","","","","","10.85","","","1.3","","",""
"128","1980-01-01 00:00:00","17","en","1652412399","2","1","","0","4","1","1","0","0","0","0","0","3","8","1","/surveys/upload/surveys/841769/files/agent1_random_8.mp4","/surveys/upload/surveys/841769/files/agent2_random_8.mp4","/surveys/upload/surveys/841769/files/agent3_random_8.mp4","","","","","","A3","A3","A2","A2","A1","","","","","","","A2","","","","1","Pretty similiar to the last AI. Avoiding ghosts and doing the best job as possible.","1","1","0","1","0","0","5","They were using pac man so that is one object that is really focused. They avoided ghosts and ate alot of rectangles.","","1","This AI was focusing on eating alot of ghosts","1","0","1","1","0","0","6","This AI ate alot of power pills and ate alot of ghosts","","2","To avoid ghosts and collect as many rectangles as possible","1","1","1","0","0","0","5","Based off what the AI went for it seemed like the most used objects.","4","4","4","3","","","","","","1","1","1","5","Player A ate alot more rectangles and destroyed more ghosts than player b","","","1","1","1","2","They both seemed to do a pretty good job so it is a hard choice but player A seemed a bit more effecient","","","1","1","1","6","Player B was running into alot of ghosts without eating the power pill. PLayer A was eating the ghosts.","4","3","3","3","","","","50","159da227c","","814.22","48.8","","","","","","","","","","2.88","","","","","","","17.81","","","51.76","","","","","","145.13","","","5.16","","","6.82","","","","2.2","","","144.99","","","","","","","64.25","","","","","","","122.34","","","","","","","21.39","","","47.87","","","","","","","","59.68","","","","","","","","60.61","","","","","","","","11.01","","","1.52","","",""
"129","1980-01-01 00:00:00","17","en","1432055056","3","1","","0","2","1","1","1","0","0","0","0","4","5","4","/surveys/upload/surveys/841769/files/agent1_highlights_div_lrp.mp4","/surveys/upload/surveys/841769/files/agent2_highlights_div_lrp.mp4","/surveys/upload/surveys/841769/files/agent3_highlights_div_lrp.mp4","","","","","","A3","A3","A2","A2","A1","","","","","A1","A2","A2","","","","1","Agent was just after the pills","0","1","0","0","0","0","3","I watched the video critically","","3","It looks random","1","1","1","0","0","0","4","The agent was basically going after the pills","","1","The agent was going after the normal pills","0","1","0","0","0","0","4","I watched the video critically","4","4","4","","4","4","","","","1","1","2","4","Player B was more cautious","","","0","0","1","5","Player A was more cautious","","","3","1","1","5","Player A was more cautious","4","3","4","","4","3","","10","39da227c","","1057.81","42.76","","","","","","","","","","1.87","","","","","","","11.37","","","88.87","","","","","","90.23","","","10.97","","","53.75","","","","27.8","","","85.2","","","","","","","216.33","","","","","","","235.32","","","","","","","21.31","","","36.48","","","","","","","","22.74","","","","","","","","99.54","","","","","","","","12.13","","","1.14","","",""
"130","1980-01-01 00:00:00","17","en","593990547","4","1","","0","4","0","","","","","","","4","5","3","/surveys/upload/surveys/841769/files/agent1_random_lrp_5.mp4","/surveys/upload/surveys/841769/files/agent2_random_lrp_5.mp4","/surveys/upload/surveys/841769/files/agent3_random_lrp_5.mp4","","","","","","A3","A3","A2","A2","A1","","","","","A1","A2","A2","","","","2","It focused on getting the power up pills.","0","0","1","0","1","0","5","I just watched the video and it seemed like it didn't care to clear an area it just wanted to get to the next power pill.","","2","I think it was trying to actually get as many of the dots as possible and the blue ghosts. I think it was playing the game properly.","1","1","0","0","1","0","5","The video seems to me like it was trying to play the game properly. Acquire pills, eat blue ghosts.","","2","It seemed to be somewhat broken. It didn't seem to be trying to accomplish anything at all other than chasing the cherry I guess that might be a strategy.","0","0","0","0","0","1","4","Just watching the video boss... It seemed to only care about the cherry.","2","2","3","","3","3","I couldn't really piece it together that well just from watching.","","","1","1","1","7","Player B seemed to be pretty lost.","","","3","2","2","1","Player B seemed to have a better performance but Player A seemed to have a better understanding of where the ghosts were. I am not fully sure on this one.","","","1","1","2","7","Player B seemed to have a better grasp of the mechanics.","2","3","2","","5","3","It's actually a little hard to know if you're seeing what you think you are without any feedback.","20","206da227d","","1286.37","74.39","","","","","","","","","","0.77","","","","","","","167.92","","","73.08","","","","","","0.39","","","53.67","","","33.64","","","","0.97","","","181.91","","","","","","","137.8","","","","","","","122.25","","","","","","","82.72","","","56.62","","","","","","","","151.03","","","","","","","","69.18","","","","","","","","79.35","","","0.68","","",""
"131","","8","en","2089372626","4","1","","0","4","1","1","0","0","0","0","0","6","4","1","/surveys/upload/surveys/841769/files/agent1_random_4.mp4","/surveys/upload/surveys/841769/files/agent2_random_4.mp4","/surveys/upload/surveys/841769/files/agent3_random_4.mp4","","","","","","A3","A3","A2","A2","A1","","","","","","","A2","","","","","","","","","","","","","","","","","","","","","","","","","","-1","","","","","","","","","","","","","","","","","","","","","","","","","","","","","","","","","","","","","","","","","","","","","","","","357.92","76.86","","","","","","","","","","1.68","","","","","","","120.87","","","35.7","","","","","","1.5","","","27.84","","","91.84","","","","1.63","","","","","","","","","","","","","","","","","","","","","","","","","","","","","","","","","","","","","","","","","","","","","","","","","","","","","","","","",""
"132","","3","en","260986811","2","2","","0","3","1","1","0","0","0","0","0","2","4","3","/surveys/upload/surveys/841769/files/agent1_random_lrp_4.mp4","/surveys/upload/surveys/841769/files/agent2_random_lrp_4.mp4","/surveys/upload/surveys/841769/files/agent3_random_lrp_4.mp4","","","","","","","","","","","","","","","","","","","","","","","","","","","","","","","","","","","","","","","","","","","","","","","","","","","","","","","","","","","","","","","","","","","","","","","","","","","","","","","","","","","","","","","","","","","736.91","45.08","","","","","","","","","","0.62","","","","","","","691.21","","","","","","","","","","","","","","","","","","","","","","","","","","","","","","","","","","","","","","","","","","","","","","","","","","","","","","","","","","","","","","","","","","","","","","","","","","","",""
"133","1980-01-01 00:00:00","17","en","705313840","3","2","","0","4","0","","","","","","","3","5","4","/surveys/upload/surveys/841769/files/agent1_highlights_div_lrp.mp4","/surveys/upload/surveys/841769/files/agent2_highlights_div_lrp.mp4","/surveys/upload/surveys/841769/files/agent3_highlights_div_lrp.mp4","","","","","","A3","A3","A2","A2","A1","","","","","A1","A2","A2","","","","1","The AI seemed to focus on high-points targets, like the blue ghosts and the cherries. It also seemed to be ""looking"" around more (more widespread green in the video).","1","0","0","0","1","1","4","I noticed more widespread green in this video as compared to the others, so perhaps the AI was scanning a larger area for high-points items.","","1","This agent seemed to focus on the location of ghosts in order to get the power pills, transform the ghosts into blue ghosts, and then eat them. ","1","0","1","0","1","0","5","I noticed the AI in this video focused mostly on the ghosts rather than the normal pills.","","2","The AI seems to focus on the power pills and then on the normal pills around them secondarily.","1","1","1","0","0","0","5","I watched the video and focused on the green areas, and also noticed the different clips all revolving around obtaining the power pills.","4","3","4","","4","4","I feel as though this came with somewhat of a learning curve, so I hope I was able to interpret the videos correctly. Thanks! :)","","","1","1","2","5","Agent B seemed to focus on the large pills (sorry, I forget their exact name) more effectively than Agent A did.","","","1","1","2","6","Agent B seemed to focus on the large pills more effectively than A, and A also moved a bit randomly in empty space at some points. B also managed to get the cherries.","","","1","1","1","5","Agent A seemed to look (green shading) at relevant, closeby areas, while Agent B would often look far away, which felt irrelevant.","4","3","4","","4","3","I feel a bit confused now by the green highlighting and watching it in each video--I don't know if I would prefer an AI that ""looked"" around more at the board, or focused more in a small area to accomplish a task.","10","22ea227c","","1015.6","40.86","","","","","","","","","","1.56","","","","","","","125.04","","","49.58","","","","","","2.78","","","25.27","","","71.43","","","","1.01","","","89.65","","","","","","","116.1","","","","","","","113.15","","","","","","","36.74","","","50.57","","","","","","","","67.27","","","","","","","","171.35","","","","","","","","52.21","","","1.03","","",""
"134","1980-01-01 00:00:00","17","en","477505071","2","1","","0","1","1","1","1","1","0","0","0","5","10","3","/surveys/upload/surveys/841769/files/agent1_random_lrp_10.mp4","/surveys/upload/surveys/841769/files/agent2_random_lrp_10.mp4","/surveys/upload/surveys/841769/files/agent3_random_lrp_10.mp4","","","","","","A3","A3","A2","A2","A1","","","","","A1","A2","A2","","","","1","The Al agent was told to play the Pacman in which it played it very well ","1","1","0","1","0","0","6","It played on it so as to win and gain more points ","","2","The AL agent strategically played the Pacman and the green green heatman shows how relevant will be the augment ","0","1","1","0","0","0","5","It was visible  and clear ","","1","The Al made the patman blue and avoided the ghost ","0","0","1","1","0","0","5","The pacman ate the pills","1","1","1","","1","1","The information is not explanatory enough for understanding ","","","1","1","2","7","The Al agents knows and Did what was right ","","","1","1","2","6","The Al agent knows whats right to do and how to win ","","","1","1","1","6","It controls the pacman  well","4","5","4","","3","4","Great ","10","145ca227d","","1920.02","122.84","","","","","","","","","","2.07","","","","","","","114.43","","","230.89","","","","","","131.96","","","25.71","","","81.71","","","","49.32","","","209.1","","","","","","","223.76","","","","","","","266.6","","","","","","","66.45","","","218.58","","","","","","","","87.22","","","","","","","","71.23","","","","","","","","16.51","","","1.64","","",""
"135","1980-01-01 00:00:00","17","en","1465278508","4","2","","0","4","0","","","","","","","5","4","1","/surveys/upload/surveys/841769/files/agent1_random_4.mp4","/surveys/upload/surveys/841769/files/agent2_random_4.mp4","/surveys/upload/surveys/841769/files/agent3_random_4.mp4","","","","","","A3","A3","A2","A2","A1","","","","","","","A2","","","","49","To eat power pellets and then eat the ghosts to get as many as possible in jail so they would be free to clear out the maze. ","1","0","1","0","1","0","5","I noticed that there were at least a couple ghosts gathering in ghost jail. There also seemed to be various sets of ghost eyes wandering around the maze.  I figured that the AI is probably going after the ghosts first to neutralize that threat. ","","112","I think this Pac-Man is trying to clear out all the pills in all the corners first.","1","1","1","0","0","0","4","I had to watch a while, but after a while I noticed, that his corners were emptying out before everything else. And he seemed to be waiting to collect the other pills toward the end. ","","23","To eat the pills along the outer edges first and to get to all the power pills. ","1","1","1","0","0","0","5","The pacman seemed to stay on the outer edges of the game. With each new scene it seemed like the power pills were disappearing quickly. PacMan exited the scene on one edge and reentered on the other, as if it wanted to remain only along the outer edges. And then it proceeded to eat pills mainly along the outer edges. ","4","3","3","4","","","","","","2","1","1","6","Player A has a defense strategy to hold off the ghosts. Player A seems to have found a way to clear more pills more quickly than Player B. Player B is almost out of Power Pills and is soon going to find themselves in a situation where they are trapped by a ghost. I think Player A has the better strategy.","","","14","2","2","7","Player B seems to have a better strategy for attacking the ghosts and keeping them at bay, freeing up time to eat more pills. Player A doesn't seem to have much of a strategy for dealing with the ghosts. ","","","3","15","2","5","Player B cleared out a lot more pills than A had. Player A still had a lot of pills to collect and no Power Pills left. I think Player B had a slightly better strategy. ","4","4","3","4","","","","40","247ea227f","","2965.05","76.76","","","","","","","","","","1.18","","","","","","","350.81","","","107.89","","","","","","1.27","","","29.76","","","13.74","","","","1.11","","","708.49","","","","","","","608.13","","","","","","","408.63","","","","","","","41.12","","","183.02","","","","","","","","162.97","","","","","","","","250.34","","","","","","","","19.2","","","0.63","","",""
"136","1980-01-01 00:00:00","17","en","1252980757","2","1","","0","2","0","","","","","","","6","1","3","/surveys/upload/surveys/841769/files/agent1_random_lrp_1.mp4","/surveys/upload/surveys/841769/files/agent2_random_lrp_1.mp4","/surveys/upload/surveys/841769/files/agent3_random_lrp_1.mp4","","","","","","A3","A3","A2","A2","A1","","","","","A1","A2","A2","","","","2","it seemed to focus greatly on the area directly in front of the pacman, and focus on the pellets.","1","1","0","0","0","0","7","It really liked to just go for them pellets man","","1","It mainly appears to be attempting to maximize the pills while avoiding the ghosts a little. It doesn't seem to care about the power pills or the blue ghosts.","1","1","0","0","1","0","5","They were the objects that spent the most time being the most green","","1","They seem to really do the same thing each time. I think that they're focusing on the front area of the pacman and they look out for the ghosts a bit more this time, based on the fact that the whole area seems to have more tufts of green in it. ","1","1","0","1","0","0","5","Based on the greenness","3","2","4","","3","2"," ","","","1","1","2","5","It just seemed to be focusing on more important things","","","1","1","1","4","They both just kind of feel similar? ","","","1","0","2","7","Player A just seemed dumb to be honest.","3","4","2","","3","3"," ","30","158da227d","","1551.35","14.45","","","","","","","","","","0.88","","","","","","","7.96","","","164.21","","","","","","8.82","","","7.77","","","11.06","","","","0.48","","","53.21","","","","","","","263.57","","","","","","","815.55","","","","","","","17.91","","","98.27","","","","","","","","44.8","","","","","","","","32.57","","","","","","","","8.72","","","1.12","","",""
"137","1980-01-01 00:00:00","17","en","1382675841","3","1","","0","3","1","1","1","0","0","0","0","4","8","1","/surveys/upload/surveys/841769/files/agent1_random_8.mp4","/surveys/upload/surveys/841769/files/agent2_random_8.mp4","/surveys/upload/surveys/841769/files/agent3_random_8.mp4","","","","","","A3","A3","A2","A2","A1","","","","","","","A2","","","","2","The agent seemed to go for long stretches of pills first and was not thorough in eating all the pills. They also seemed to use the 4 power pills quite early, leaving them with fewer options later in the game. ","1","1","1","0","0","0","3","The AI clearly wanted to go for long stretches of pills, as there were no long chains left, but didn't do back and thoroughly clean up the pills. They didn't seem very interested in eating ghosts, but did use the power pills quickly. ","","3","The AI seemed focused on quickly getting the power pills and eating the blue ghosts. Even to the point where it seemed to ignore the cherries and put itself in danger to reach the blue ghosts.","0","0","1","0","1","0","5","The power pills were quickly consumed in the games. When a cherry came on screen, the AI chose to pursue a blue ghost over the cherry and the AI crossed quite close to a normal ghost exiting the center to pursue a blue ghost.","","2","The AI seemed to be most interested in power pills and cherries. They weren't too concerned about ghost placement and didn't seem to alter behavior when the ghosts were blue. They did, however, clearly want to get to the cherries, but didn't seem able to navigate the maze effectively. ","0","0","1","0","0","1","4","There was little self-preservation going on in the form of ghost avoidance. They didn't seem to target blue ghosts at all, or even really pay attention to the ghosts. When the cherry came onto the screen, though, they immediately turned to face it. ","4","2","2","4","","","It would be interesting to see longer clips of the AI's playing.","","","1","1","1","5","Player A seems more able to avoid being eaten, even at the expense of higher point actions. I would think that the longevity of this player's pacmen would allow for greater point accumulation. ","","","1","1","2","3","Plater B seems slightly better at navigating and ghost avoidance, so i would hope this would lead to longer game times and higher point accumulation. ","","","1","1","2","4","Player B is less focused on the cherries, which do not occur frequently enough to be meaningful. They also seem more interested in eating blue ghosts, which could equal a great total score overall. ","4","2","2","5","","","","30","159ea227d","","1458.16","69.2","","","","","","","","","","0.55","","","","","","","312.27","","","34.64","","","","","","0.97","","","34.68","","","13.65","","","","0.99","","","211.55","","","","","","","175.5","","","","","","","196.88","","","","","","","37.04","","","132.27","","","","","","","","92.49","","","","","","","","105.65","","","","","","","","38.74","","","1.09","","",""
"138","1980-01-01 00:00:00","17","en","1577044212","5","1","","0","4","1","0","1","0","0","0","0","4","1","1","/surveys/upload/surveys/841769/files/agent1_random_1.mp4","/surveys/upload/surveys/841769/files/agent2_random_1.mp4","/surveys/upload/surveys/841769/files/agent3_random_1.mp4","","","","","","A3","A3","A2","A2","A1","","","","","","","A2","","","","2","He is eating the regular dots.","0","1","0","0","0","0","6","Because the video shows pac man only eating regular dots.","","1","What? I don't see a sensible, coherent strategy. Pac man is spinning his wheels, back and forth. ","0","1","0","0","0","0","1","Pac man is doing nothing.","","1","He is eating power pills to eat the resulting blue ghosts.","0","0","1","0","1","0","5","In every snippet, it shows pac man eating a power pill then gobbling up the blue ghosts.","3","2","4","2","","","","","","2","1","2","5","B is at least earring blue ghosts.","","","1","1","1","5","Look, neither are good pac man players, but A has eaten the most dots and power pellets.","","","1","1","2","5","B has eaten the most dots to get to the next level at least.","2","2","3","3","","","","30","237ea227d","","1475.03","73.35","","","","","","","","","","2.07","","","","","","","169.7","","","157.72","","","","","","1.48","","","10.51","","","27.88","","","","1.99","","","159.59","","","","","","","127.88","","","","","","","219.49","","","","","","","30.31","","","109.29","","","","","","","","239.73","","","","","","","","108.61","","","","","","","","32.6","","","2.83","","",""
"139","1980-01-01 00:00:00","17","en","226326109","5","1","","0","2","1","1","0","0","0","0","0","4","2","4","/surveys/upload/surveys/841769/files/agent1_highlights_div_lrp.mp4","/surveys/upload/surveys/841769/files/agent2_highlights_div_lrp.mp4","/surveys/upload/surveys/841769/files/agent3_highlights_div_lrp.mp4","","","","","","A3","A3","A2","A2","A1","","","","","A1","A2","A2","","","","2","Earning points by eating","0","1","0","0","1","0","5","Each portion of the video was different. Earning points by eating in all but one. The one without eating was pacman turning back an forth.","","3","To keep moving and not stay in one place.","1","0","0","0","0","0","1","Every piece of video was completely different. I do not see a clear strategy on this video.","","2","Eating the power pills.","0","0","1","0","0","0","7","That is what each portion of the video showed me... pacman eating the power pills","4","1","3","","2","2","","","","1","1","1","7","All B was doing was eating power pills and turning around. Not a good strategy","","","1","2","1","7","B died in one of the parts. I dont like to die","","","1","1","2","6","B seemed to be moving through the maze better","3","3","2","","3","1","","30","99ea227d","","1401.36","68.4","","","","","","","","","","0.78","","","","","","","137.6","","","27.82","","","","","","1.17","","","25.61","","","33.33","","","","0.67","","","176.41","","","","","","","446.51","","","","","","","132.29","","","","","","","39.88","","","115.68","","","","","","","","88.78","","","","","","","","73.14","","","","","","","","31.95","","","1.34","","",""
